notice_number,recipient_name,served_date,notice_type,description,compliance_date,revised_compliance_date,result,address,region,local_authority,industry,main_activity,type_of_location,hse_group,hse_directorate,hse_area,hse_division,cytora_ingest_ts
312405584,Valbone Mulaj,01/04/2022,Improvement Notice,"I/RJB/01/04/22/02- You have not ensured that the Compressor, in use at your premises has been thoroughly examined by a 
competent person within the intervals specified in a written scheme of examination 

 I/RJB/01/04/22/04 - You have failed to ensure that the exposure of employees to welding fume is adequately controlled because 
you are not using the most effecive and reliable control measures, such as Local Exhaust Ventiliation or 
respiratory protective equipment, to prevent or reduce exposure.",01/07/2022,,Ongoing,Unit 16 Such Close / Valbone MLetchworth Diamond WheelsUnit 16Such CloseLETCHWORTH GARDEN CITYHertfordshireSG6 1JFEngland,East & South East,North Hertfordshire,Total service industries,45200 - MVR,Fixed,FODOP5GP19,Field Operations Division,,East,2022-05-18 08:46:08.035474+00:00
